<?xml version="1.0" encoding="UTF-8"?>
<stmset xmlns:xsi="http://www.w3.org/2000/10/XMLSchema-instance"
	xmlns="http://www.barzer.net/barzel/0.1">
	<!--
		for some reason xmllint doesn't like this
		xsi:schemaLocation="http://www.barzer.net/barzel/0.1 barzel.xsd">
	-->
	<stmt>
		<pat>
			<any>
				<t>bob</t>
				<t>alice</t>
			</any>
			<t>mama</t>
			<t>myla</t>
			<t>ramu</t>
			<opt>
				<t>s mylom</t>
			</opt>
			<perm>
				<t>foo</t>
				<n />
				<any>
					<n />
				</any>
			</perm>
		</pat>
		<tran>
			<rn v="56" />
		</tran>
	</stmt>
	<stmt>
		<pat>
			<t>6</t>
			<opt>
				<n />
				<wcls>verb</wcls>
			</opt>
		</pat>
		<tran>
			<ltrl>lala</ltrl>
		</tran>
	</stmt>
	<stmt>
		<pat>
			<t>100</t>
			<n />
		</pat>
		<tran>
			<rn v="200" />
		</tran>
	</stmt>
	<stmt>
		<pat>
			<n />
			<t>shit</t>
		</pat>
		<tran>
			<rn v="200" />
		</tran>
	</stmt>
	<!-- this is a simplified version of one of the statements generated by mkxml.py.
		 the original non simplified one was generating almost 400k trie paths.
		 simplified to make profiling a bit more manageable -->
	<stmt>
		<pat>
			<opt>
				<opt>
					<t>SoW</t>
					<n />
					<opt>
						<any>
							<p>$</p>
							<p>_</p>
						</any>
						<t>FLAW</t>
					</opt>
					<t>uSMF</t>
				</opt>

				<any>
					<p>}</p>
					<any>
						<opt>
							<n />
							<t>KAM</t>
							<p>/</p>
							<n h="8743" l="29450" />
						</opt>
						<n />
						<p>!</p>
						<t>lr</t>
					</any>
					<n h="0.452623" l="0.502469" r="true" />
				</any>

				<list>
					<list>
						<t>LkRRJzg</t>
						<n h="26524" l="31602" />
					</list>
					<opt>
						<n h="20070" l="23597" />
						<opt>
							<p>{</p>
							<t>PxukFm</t>
						</opt>
						<n h="1234" l="22393" />
					</opt>
					<list>
						<n />
						<p>+</p>
						<opt>
							<t>YNjFXJuE</t>
							<p>+</p>
						</opt>
						<p>\</p>
					</list>
					<p>\</p>
				</list>
				<n h="0.234674" l="0.717309" r="true" />
			</opt>

			<list>
				<any>
					<t>YeDSZqAgbU</t>
					<opt>
						<list>
							<t>VCPETQBFB</t>
							<p>,</p>
						</list>
						<n h="2810" l="9973" />
						<n />
					</opt>
					<t>qw</t>
					<n h="0.194325" l="0.496656" r="true" />
				</any>

				<list>
					<p>$</p>
					<list>
						<n />
						<p>#</p>
					</list>
					<n h="7686" l="31006" />
					<p>`</p>
					<p>`</p>
					<t>cgqw</t>
				</list>
			</list>
			<opt>
				<p>"</p>
				<opt>
					<any>
						<p>.</p>
						<n />
						<t>eRwwzf</t>
						<list>
							<p>#</p>
							<t>eemHLHhPX</t>
							<p>.</p>
							<p>;</p>
							<t>UOufQLLyhb</t>
						</list>
					</any>
					<opt>
						<n h="0.475731" l="0.603058" r="true" />
						<n h="0.442152" l="0.458857" r="true" />
						<list>
							<t>zXBTBKFAt</t>
							<t>IAh</t>
							<n h="0.266579" l="0.929188" r="true" />
						</list>
						<t>GMXZrBR</t>
						<p>(</p>
						<n h="0.037169" l="0.300429" r="true" />
					</opt>
					<opt>
						<p>\</p>
						<list>
							<t>ePJzmsHu</t>
							<p>_</p>
							<t>uXFCEt</t>
							<t>jwitAqA</t>
							<t>TCUXJVH</t>
						</list>
						<t>RtzUmcWBZd</t>
					</opt>
					<p>{</p>
					<t>bQlPEk</t>
				</opt>
				<t>ukRs</t>
				<p>@</p>
				<any>
					<n />
					<n h="1509" l="1906" />
					<t>sShpY</t>
					<t>V</t>
				</any>
				<t>Ec</t>
			</opt>
			<t>HpnwzJOy</t>
		</pat>
		<tran>
			<rn v="13820" />
			<var>DCwLIoi</var>
			<rn v="18023" />
			<ltrl>AflSYpVd</ltrl>
			<var>OUoprXsTZ</var>
		</tran>
	</stmt>
</stmset>
