<?xml version="1.0" encoding="UTF-8"?>
<stmset xmlns:xsi="http://www.w3.org/2000/10/XMLSchema-instance"
	xmlns="http://www.barzer.net/barzel/0.1">
	<!--
		for some reason xmllint doesn't like this
		xsi:schemaLocation="http://www.barzer.net/barzel/0.1 barzel.xsd">
	-->
	<stmt>
		<pat>
			<t>China</t><n/><p>/</p>
		</pat>
		<tran>
			<rn>
			<var w="1"/>
			<rn v="56"/>
			</rn> 
			<func name="mkDate"><rn v="9" /><rn v="10" /><rn v="2011" /></func>
		</tran>
	</stmt>
    <stmt>
        <pat>
            <n l="1" h="12"  /><n  l="1" h="31"/><n l="1900" h="2100"/>
        </pat>
        <tran><func name="mkDate"><var w="1" /><var w="2" /><var w="3" /></func></tran>
    </stmt>
</stmset>
            
